full_name,stars,forks,language,created_at,description,url
yasserhessein/deep-learning-classification-mammographic-mass,5,1,Jupyter Notebook,2020-11-25T18:46:58Z,"Data Set Information:  Mammography is the most effective method for breast cancer screening available today. However, the low positive predictive value of breast biopsy resulting from mammogram interpretation leads to approximately 70% unnecessary biopsies with benign outcomes. To reduce the high number of unnecessary breast biopsies, several computer-aided diagnosis (CAD) systems have been proposed in the last years.These systems help physicians in their decision to perform a breast biopsy on a suspicious lesion seen in a mammogram or to perform a short term follow-up examination instead. This data set can be used to predict the severity (benign or malignant) of a mammographic mass lesion from BI-RADS attributes and the patient's age. It contains a BI-RADS assessment, the patient's age and three BI-RADS attributes together with the ground truth (the severity field) for 516 benign and 445 malignant masses that have been identified on full field digital mammograms collected at the Institute of Radiology of the University Erlangen-Nuremberg between 2003 and 2006. Each instance has an associated BI-RADS assessment ranging from 1 (definitely benign) to 5 (highly suggestive of malignancy) assigned in a double-review process by physicians. Assuming that all cases with BI-RADS assessments greater or equal a given value (varying from 1 to 5), are malignant and the other cases benign, sensitivities and associated specificities can be calculated. These can be an indication of how well a CAD system performs compared to the radiologists.  Class Distribution: benign: 516; malignant: 445",https://github.com/yasserhessein/deep-learning-classification-mammographic-mass
akhill10/Chest-XRay-Vision,5,1,Jupyter Notebook,2018-12-30T16:44:46Z,Chest Xray image Classification using Deep learning using Pytorch ~,https://github.com/akhill10/Chest-XRay-Vision
sorna-fast/tb-chest-xray-classifier,5,1,Jupyter Notebook,2025-10-07T20:20:21Z,TB Chest X-Ray Classifier - Deep learning model for Tuberculosis detection  using CNN architecture with 99.5% accuracy and 0.999 AUC score.,https://github.com/sorna-fast/tb-chest-xray-classifier
zhugoldman/CNN-segmentation-for-Lung-cancer-OARs,5,3,Python,2018-06-12T08:41:10Z,a deep convolutional neural network (CNN)-based automatic segmentation technique was applied to the multiple organs at risk (OARs) in CT images of lung cancer,https://github.com/zhugoldman/CNN-segmentation-for-Lung-cancer-OARs
alankrit-01/COVID-19-CT-Scan,5,2,Jupyter Notebook,2021-05-12T18:19:48Z,Training a pixel segmentation neural network for classification of Covid19 lung CT-scans using UNET implemented in Tensorflow and Keras.,https://github.com/alankrit-01/COVID-19-CT-Scan
RichardChangCA/Deep-Contrastive-Metric-Learning-Method-to-Detect-Polymicrogyria-in-Pediatric-Brain-MRI,5,0,Jupyter Notebook,2022-08-07T16:07:46Z,[Journal Paper: Computerized Medical Imaging and Graphics] A Novel Center-based Deep Contrastive Metric Learning Method for the Detection of Polymicrogyria in Pediatric Brain MRI,https://github.com/RichardChangCA/Deep-Contrastive-Metric-Learning-Method-to-Detect-Polymicrogyria-in-Pediatric-Brain-MRI
eipm/ai-biopsy,4,10,Python,2019-05-30T19:41:22Z,Biopsy-free prediction of prostate cancer aggressiveness using deep learning and radiology imaging,https://github.com/eipm/ai-biopsy
JasonW375/Chest-OMDL,4,0,,2025-05-31T07:21:20Z,[MIDL 2025] Chest-OMDL: Organ-specific Multidisease Detection and Localization in Chest Computed Tomography using Weakly Supervised Deep Learning from Free-text Radiology Report,https://github.com/JasonW375/Chest-OMDL
rohithaug/sepsis-prediction,4,0,Jupyter Notebook,2022-12-01T19:43:28Z,Predict sepsis using structured data of patients who were admitted to the ICU along with their radiology reports using Deep Learning Models (CNN and LSTM),https://github.com/rohithaug/sepsis-prediction
dheerajsharma0401/Chest-Xrays-Pneumonia-Prediction,4,0,Jupyter Notebook,2021-06-26T12:11:58Z,"Chest-Xray-Pneumonia-Prediction built with OpenCV, Keras/TensorFlow using Deep Learning and Computer Vision concepts.",https://github.com/dheerajsharma0401/Chest-Xrays-Pneumonia-Prediction
benjnkns/Automatic-Organ-Segmentation,4,1,Matlab,2017-05-23T21:15:35Z,Automatic organ segmentation from CT scans with the use of generative adversarial neural networks and transfer learning of of existing neural networks.,https://github.com/benjnkns/Automatic-Organ-Segmentation
Deep-Learning-Reproduction-150/organ-segmentation,4,0,Jupyter Notebook,2022-02-28T11:42:30Z,A Novel Hybrid Convolutional Neural Network for Accurate Organ Segmentation  in 3D Head and Neck CT Images,https://github.com/Deep-Learning-Reproduction-150/organ-segmentation
afeizqf/LCOVNet,4,1,Python,2021-01-20T02:25:58Z,LCOV-NET: A LIGHTWEIGHT NEURAL NETWORK FOR COVID-19 PNEUMONIA LESION SEGMENTATION FROM 3D CT IMAGES,https://github.com/afeizqf/LCOVNet
karelbecerra/sam-x-ray-medical-images-hand-sex-classification,4,1,Jupyter Notebook,2024-12-09T14:57:29Z,Deep learning and segmentation in sex classification from left hand X-ray images in pediatric patients: how zero-shot Segment Anything Model (SAM) can improve medical image analysis,https://github.com/karelbecerra/sam-x-ray-medical-images-hand-sex-classification
dani-capellan/pTB_LungRegionExtractor,4,0,Python,2022-03-15T16:54:53Z,Multi-view deep learning-based solution that extracts lung and mediastinal regions of interest from pediatric CXR images where key TB findings may be present.,https://github.com/dani-capellan/pTB_LungRegionExtractor
bryanoliveira/bone-age-regression,4,1,Python,2020-01-16T23:04:28Z,A Deep Learning approach to solve the bone age regression problem.,https://github.com/bryanoliveira/bone-age-regression
nki-radiology/Frida,3,0,Python,2021-10-22T10:45:12Z,Collection of functions for medical image pre-processing and deep learning,https://github.com/nki-radiology/Frida
dani-capellan/pTBLightNet,3,0,Python,2025-02-13T12:24:19Z,"Official repository for pTBLightNet, a multi-view deep learning framework designed to detect pediatric pulmonary TB by identifying TB-compatible CXRs with consistent radiological findings.",https://github.com/dani-capellan/pTBLightNet
codeperfectplus/Covid19-Xray-image-Detection,3,2,Python,2021-08-06T09:36:13Z,Deep Learning and AI Enthusiasts to contribute to improving COVID-19 detection using just Chest X-rays.,https://github.com/codeperfectplus/Covid19-Xray-image-Detection
habbes/chest-xrays,3,1,Jupyter Notebook,2019-06-11T22:31:43Z,Chest X rays diagnosis using deep learning. Based on CheXpert data: https://stanfordmlgroup.github.io/competitions/chexpert/,https://github.com/habbes/chest-xrays
Ali-hey-0/radiography-xray-classifier,3,0,Jupyter Notebook,2025-08-30T12:05:50Z,"An advanced AI-powered web application for analyzing chest X-ray images to detect COVID-19, Normal, Lung Opacity, and Viral Pneumonia conditions using deep learning and Grad-CAM visualization.",https://github.com/Ali-hey-0/radiography-xray-classifier
rmit-medical-radiations/HFLung-segmentation,3,0,Jupyter Notebook,2023-09-15T07:42:39Z,"Code for our paper ""CT Ventilation Images Produced by a 3D Neural Network Show Improvement Over the Jacobian and HU DIR-Based Methods to Predict Quantised Lung Function"".",https://github.com/rmit-medical-radiations/HFLung-segmentation
ardranirwan28/bone-age-assessment,3,0,Jupyter Notebook,2026-03-21T12:47:42Z,Bone Age Assessment project using deep learning from hand x-rays,https://github.com/ardranirwan28/bone-age-assessment
abdm149/GraduationProject,3,0,Python,2023-05-19T10:25:35Z,This repository contains the code and resources for my graduation project on bone age estimation. The project focuses on developing a deep learning-based system to accurately estimate the skeletal maturity of individuals based on their hand X-ray images.,https://github.com/abdm149/GraduationProject
rajathpi/automatic-report-generator,2,2,Jupyter Notebook,2022-05-31T01:14:09Z,Automatic Medical Report Generation from Radiology Chest X-Ray using Deep learning strategy.,https://github.com/rajathpi/automatic-report-generator
CS-598-Deep-Learning-for-Healthcare/Onprem-Radiology-Anomaly-Classification,2,0,Python,2025-11-13T02:20:50Z,,https://github.com/CS-598-Deep-Learning-for-Healthcare/Onprem-Radiology-Anomaly-Classification
BrahimMaarouf/vixora-radiology,2,0,Jupyter Notebook,2026-03-26T10:59:46Z,"AI system for chest X-ray analysis using deep learning. Classifies images (Normal/Pneumonia), outputs confidence score, and provides Grad-CAM visualization. Built with CNNs and transfer learning (ResNet, VGG, EfficientNet) with a simple web interface for fast, reliable diagnosis support.",https://github.com/BrahimMaarouf/vixora-radiology
Vignesh-Thiagarajan-DS/Clinical-Vision-Deep-Learning-Classifier,2,1,Jupyter Notebook,2025-08-23T22:40:02Z,Using Deep Learning and Computer Vision for automated Pathology Classification in radiology. This PyTorch project applies a CNN with Transfer Learning to showcase proof-of-concept for an AI-assisted diagnostic workflow.,https://github.com/Vignesh-Thiagarajan-DS/Clinical-Vision-Deep-Learning-Classifier
rtharungowda/Covid19-xray-classifier,2,1,Jupyter Notebook,2020-04-21T16:02:35Z,BInary classification of chest radiology  (x-ray) images of potential covid-19 patients through deep learning,https://github.com/rtharungowda/Covid19-xray-classifier
LisongDai/ReportGuidedNet,2,1,Python,2023-09-20T04:18:37Z,A deep learning model for brain lesion detection guided by a knowledge derived from radiology reports,https://github.com/LisongDai/ReportGuidedNet
shahanHasan/Chest-X-ray-Classification,2,0,Jupyter Notebook,2024-12-12T23:05:50Z,"Application of Deep Learning Algorithms alongside Explainable AI (Grad-cam, attention visualization) for the Classification of Infectious Diseases in Chest Radiological images.",https://github.com/shahanHasan/Chest-X-ray-Classification
chestrad/histological_basis,2,0,Python,2022-03-11T03:18:49Z,"Code used for ""Histopathologic basis for a Chest CT Deep Learning Survival Prediction Model in Patients with Lung Adenocarcinoma"", which was submitted to Radiology",https://github.com/chestrad/histological_basis
was-siri-us/Radix.Ai,2,1,Python,2024-03-22T16:39:10Z,"Radix.ai automates report generation by using Deep Learning to detect pulmonary abnormalities in chest X-rays and transformer models to create detailed radiology reports, all within an intuitive web application.",https://github.com/was-siri-us/Radix.Ai
XinRuiZhou0106/CaroNet-Dynamic-2.0,2,0,Python,2025-06-16T10:26:47Z,Codes for European Journal of Radiology (EJR) 2025 paper. Human‒machine interaction based on real-time explainable deep learning for higher accurate grading of carotid stenosis from transverse B-mode scan videos.,https://github.com/XinRuiZhou0106/CaroNet-Dynamic-2.0
Mmat97/RadAlert,2,1,Jupyter Notebook,2025-10-22T19:04:41Z,RadAlert is a first-of-its-kind multimodal deep learning system that integrates radiological imaging data and electronic health record (EHR) features to predict the likelihood of malignancy in breast MRI scans with human-context awareness.,https://github.com/Mmat97/RadAlert
ClownMonster/Covid19_Detection_Using_Xrays,2,3,Python,2020-05-31T01:26:55Z,"Using Pythons Machine Learning And Deep Learning libraries, making an attempt to create a model which can  detect the covid infected patients  from their chest X-ray",https://github.com/ClownMonster/Covid19_Detection_Using_Xrays
arafatfahim/COVID19-Detection-using-ChestXRay,2,0,,2021-10-05T18:32:27Z,Deep Learning Project,https://github.com/arafatfahim/COVID19-Detection-using-ChestXRay
NadiaKhodaei/ChestXRay_Medical_Diagnosis_Deep_Learning,2,0,Jupyter Notebook,2022-09-15T10:05:29Z,Chest x ray medical diagnosis,https://github.com/NadiaKhodaei/ChestXRay_Medical_Diagnosis_Deep_Learning
d33pster/COVID-19-DL-ChestXray,2,0,Python,2023-04-21T23:45:11Z,Deep Learning Based Coronavirus (COVID-19) detection using chest Xrays,https://github.com/d33pster/COVID-19-DL-ChestXray
JVedant/ChestXray-Pneumonia,2,0,Python,2020-11-28T04:32:10Z,webapp based on flask to classify xray's into pneumonia containing or not using Deep Learning,https://github.com/JVedant/ChestXray-Pneumonia
sabya10-4/covid-chest-xray,2,0,Jupyter Notebook,2021-01-05T04:18:03Z,Deep learning model to predict covid from chest x-rays,https://github.com/sabya10-4/covid-chest-xray
yashwardhan-gautam/Chest-Xray-analysis,2,1,Jupyter Notebook,2020-03-05T06:05:17Z,Detecting lung diseases from analysis of chest using deep learning model,https://github.com/yashwardhan-gautam/Chest-Xray-analysis
paul-data-science/Deep-Learning-Covid-CXR,2,0,Jupyter Notebook,2020-11-18T16:11:56Z,NJIT CS677 Deep Learning Project Explainability of Covid Chest Xrays,https://github.com/paul-data-science/Deep-Learning-Covid-CXR
deepakkumar-ml/Chest-Xray-Pneumonia-Detection,2,0,Jupyter Notebook,2026-05-24T09:46:54Z,Deep Learning project for Pneumonia Detection using Chest X-Ray images.,https://github.com/deepakkumar-ml/Chest-Xray-Pneumonia-Detection
IeeeXpert/Chest-Xray-Pulmonary-Tuberculosis-Detection-using-Deep-learning,2,0,,2021-09-22T10:48:25Z,,https://github.com/IeeeXpert/Chest-Xray-Pulmonary-Tuberculosis-Detection-using-Deep-learning
abshubh/Covid-19-Detection-using-Chest-Xray-Images-through-Deep-Learning,2,0,MATLAB,2020-10-19T14:29:23Z,,https://github.com/abshubh/Covid-19-Detection-using-Chest-Xray-Images-through-Deep-Learning
aakashratha1006/Chest-Xray-COVID-Detection-CNN,2,0,Jupyter Notebook,2020-06-04T17:09:54Z,"Detecting COVID-19 in chest xray images(Input) with keras, tensorflow and deep learning - used Convolutional Neural Networks (CNN).",https://github.com/aakashratha1006/Chest-Xray-COVID-Detection-CNN
sa1ah-ai/chest-xray-pneumonia-detector,2,0,Jupyter Notebook,2025-07-12T17:52:36Z,"End-to-end deep learning pipeline for automated pneumonia diagnosis from chest X-ray images. Utilizes EfficientNetB4, data augmentation, and comprehensive evaluation with clear visualizations.",https://github.com/sa1ah-ai/chest-xray-pneumonia-detector
NightKnight-nx2/chest-xray-pneumonia-detection,2,0,Python,2026-04-08T16:29:11Z,"A deep learning image classification project for pneumonia detection from chest X-rays, focusing on class imbalance management, medical metric optimization, and model interpretability using Grad-CAM.",https://github.com/NightKnight-nx2/chest-xray-pneumonia-detection
Daniel-Sensei/chest-xray-multitask-ai,2,0,Jupyter Notebook,2026-02-05T12:51:06Z,"Multi-task Deep Learning framework for Chest X-Ray analysis. Combines CheXNet and custom GPT-2 to perform Image Reconstruction, Binary Classification (Normal/Abnormal), and Automated Medical Report Generation.",https://github.com/Daniel-Sensei/chest-xray-multitask-ai
hitashu/Chest-XRay-Predictions,2,1,Jupyter Notebook,2020-01-25T23:41:08Z,"Pneumonia is a very common disease. It can be either: 1) Bacterial pneumonia 2) Viral Pneumonia 3) Mycoplasma pneumonia and 4) Fungal pneumonia. This dataset consists pneumonia samples belonging to the first two classes. The dataset consists of only very few samples and that too unbalanced. The aim of this kernel is to develop a robust deep learning model from scratch on this limited amount of data. We all know that deep learning models are data hungry but if you know how things work, you can build good models even with a limited amount of data",https://github.com/hitashu/Chest-XRay-Predictions
Sneheshdutta/Pneumonic-Lungs-Detection-Android-App,2,0,Java,2021-07-02T14:59:50Z,An Deep learning Based android app to detect pneumonia from chest Xray,https://github.com/Sneheshdutta/Pneumonic-Lungs-Detection-Android-App
creatorpiyush/ml_chest_xray_covid19,2,0,Jupyter Notebook,2020-07-21T04:03:59Z,"Varshney Y., Anand P., Krishna A., Nagrath P., Jain R. (2021) Detection of COVID-19 by X-rays Using Machine Learning and Deep Learning Models. In: Singh P.K., Wierzchoń S.T., Tanwar S., Ganzha M., Rodrigues J.J.P.C. (eds) Proceedings of Second International Conference on Computing, Communications, and Cyber-Security. Lecture Notes in Networks and Systems, vol 203. Springer, Singapore.",https://github.com/creatorpiyush/ml_chest_xray_covid19
uhbhy/Chest-XRay-Covid-Detection-App,2,0,Python,2024-06-07T07:29:06Z,"Streamlit-based web application for Covid-19 detection from chest X-ray images. The app offers image enhancement features like contrast and brightness adjustment, followed by a diagnosis module utilizing a deep learning model. Users can upload X-ray images for processing and receive real-time diagnosis results.",https://github.com/uhbhy/Chest-XRay-Covid-Detection-App
LaurentVeyssier/Detecting-COVID-19-with-chest-X-Ray-using-PyTorch,2,1,Jupyter Notebook,2020-10-02T13:52:16Z,Deep learning model to classify XRay Scan images between 3 classes and detect COVID19,https://github.com/LaurentVeyssier/Detecting-COVID-19-with-chest-X-Ray-using-PyTorch
Wayne3918/Lung-CT-nodule-segmentation-using-multi-resolution-neural-networks,2,0,Python,2022-06-21T09:08:35Z,,https://github.com/Wayne3918/Lung-CT-nodule-segmentation-using-multi-resolution-neural-networks
SoundaryaDube/surgical-segmentation-app,2,0,Python,2025-08-29T05:59:22Z,Developed an AI-driven diagnostic tool that processes MRI/CT scans using convolutional neural networks (CNNs) to detect tumors and abnormalities with high accuracy.,https://github.com/SoundaryaDube/surgical-segmentation-app
GitHub-TXZ/CaW-Segmentation-and-Detection,2,0,Python,2023-04-08T13:49:20Z,Codes and Tools for manuscript “A Two-Stage Convolutional Neural Network for Segmentation and Detection of Carotid Web on CT Angiography” submitted to Journal of NeuroInterventional Surgery,https://github.com/GitHub-TXZ/CaW-Segmentation-and-Detection
SarielMa/SPIE2023,2,0,Python,2023-01-24T17:45:37Z,Towards Lifting the Trade-off between Accuracy and Adversarial Robustness of Deep Neural Networks with Application on COVID 19 CT Image Classification and Medical Image Segmentation,https://github.com/SarielMa/SPIE2023
OliverAust/Tib-Cort-Seg,2,0,Python,2021-12-21T13:02:51Z,"Documentation and Model of the results presented in the publication ""Tibia Cortical Bone Segmentation in Micro-CT and X-ray Microscopy Data Using a Single Neural Network"" published in Bildverarbeitung für die Medizin (BVM) conference 2022.",https://github.com/OliverAust/Tib-Cort-Seg
Dipannoy/DICOM_GNN,2,0,Python,2021-11-05T10:08:07Z,"Graph Neural Network was applied on DICOM CT scan data set to explore the pixel patterns. We had a CT scan data series of a patient. Each CT slice has been converted to a graph structure where each node of the graph indicates a specific superpixel. The superpixels have been generated with a segmentation algorithm. Then the distances between nodes/superpixels have been calculated. After that, each graph-structured CT slice is trained with a Graph Convolutional Neural Network. After the completion of the training phase, the GNN has been operated over few slices for checking the predicted pixel arrangement of the slice. And the result was quite satisfactory.",https://github.com/Dipannoy/DICOM_GNN
nikshak/Pneumonia-Detection-using-Image-Classification,2,1,Jupyter Notebook,2021-06-06T15:35:22Z,The implementation of clinical-decision support algorithms for medical imaging faces challenges with reliability and interpretability.  We strive to demonstrate the applicability of our Artificial Intelligence system for diagnosis of pediatric pneumonia using chest X-ray images. Goal: Use various neural network deep learning machine learning models to detect pneumonia on pediatric chest X-rays,https://github.com/nikshak/Pneumonia-Detection-using-Image-Classification
afiosman/deep-learning-based-bone-age-estimation,2,0,,2024-03-26T00:59:04Z,Develop a deep learning-based model utilizing a fully connected convolutional neural network (CNN) to predict bone age from left-hand radiographs.,https://github.com/afiosman/deep-learning-based-bone-age-estimation
MRToghyani/RSNA-Bone-Age-Challenge,2,0,Jupyter Notebook,2024-06-09T10:27:24Z,Develop a deep learning model for automated bone age assessment using  hand X-ray images,https://github.com/MRToghyani/RSNA-Bone-Age-Challenge
AshleyAlexJacob/Bone-Age-Prediction-Web-Application-Using-Deep-Learning-,2,0,Python,2022-09-08T07:57:10Z,,https://github.com/AshleyAlexJacob/Bone-Age-Prediction-Web-Application-Using-Deep-Learning-
IBRADAT/Application-of-TW3-Method,2,0,Jupyter Notebook,2022-01-02T23:19:58Z,"Bone Age Assessment using TW3 method, Deep learning and machine learning algorithms",https://github.com/IBRADAT/Application-of-TW3-Method
alishelton/summerdeeplearning,2,0,Python,2017-08-17T04:44:19Z,Deep learning files for training and analyzing deep learning models on hip and spine scans to predict adolescent bone age.,https://github.com/alishelton/summerdeeplearning
PhilippeMoussalli/Deep-learning-pipeline-for-radiology-department-of-UZ-Leuven-Hospital,1,2,Python,2021-02-04T21:31:59Z,Design project for implementing a clinical pipeline to automate the process of delineation of brain tumors,https://github.com/PhilippeMoussalli/Deep-learning-pipeline-for-radiology-department-of-UZ-Leuven-Hospital
gursmeep404/Radiology,1,0,Jupyter Notebook,2025-06-17T07:45:25Z,Fine tuned T5- small model to extract structured labels from radiologist reports. Used to create labelled dataset for deep learning model training by converting unstructured diagnosis text into five key fields.,https://github.com/gursmeep404/Radiology
arvinhm/RadiologyDeepLearning,1,0,Python,2024-06-14T22:31:53Z,,https://github.com/arvinhm/RadiologyDeepLearning
falco-tigris/CS577_DeepLearning_Project,1,0,Jupyter Notebook,2023-10-17T15:25:56Z,Repository for CS577 Deep Learning Project on Radiology Report Generation,https://github.com/falco-tigris/CS577_DeepLearning_Project
harimenshi-et-al/RadiologyAI,1,0,Python,2026-02-03T01:11:10Z,"Deep learning AI classifying chest X-rays into five categories using 100,000+ images. Includes preprocessing, CNN training, and prediction evaluation, highlighting reproducible research, experimental design, and automated identification of common radiologic pathologies.",https://github.com/harimenshi-et-al/RadiologyAI
siavash-trm/Radiology-agentic-system,1,0,Jupyter Notebook,2025-09-05T19:16:52Z,"A multimodal  deep learning framework for glioma 3D segmentation, radiology report generation ,radiogenomic analysis  and treatment plan",https://github.com/siavash-trm/Radiology-agentic-system
nitindw/Radiology_Report_Generation_Using_Transformer,1,0,,2024-08-03T13:27:58Z,A python script transformer model(Deep Learning) based used to generate radiology report for a X-Image.,https://github.com/nitindw/Radiology_Report_Generation_Using_Transformer
MarshalLeeeeee/Lung-nodule-segmentation-and-cancer-prediction-based-on-CT-Image,1,4,Jupyter Notebook,2018-03-19T08:29:06Z,Using neural network to implement lung nodule segmentation and cancer prediction based on CT Image,https://github.com/MarshalLeeeeee/Lung-nodule-segmentation-and-cancer-prediction-based-on-CT-Image
ArthurEglin/Foot-image-segmentation-project_ME-482,1,2,Jupyter Notebook,2023-04-05T16:33:05Z,Train an artificial neural network to perform segmentation of bones in CT scans of the foot in order to reconstruct a volumetric object representing the foot in 3D.,https://github.com/ArthurEglin/Foot-image-segmentation-project_ME-482
Jalalbaim/Multi-Category-Semantic-Segmentation-on-CT-scans-Using-Deep-Neural-Networks,1,0,Jupyter Notebook,2024-11-20T13:21:40Z,Multi-Category-Semantic-Segmentation-on-CT-scans-Using-Deep-Neural-Networks,https://github.com/Jalalbaim/Multi-Category-Semantic-Segmentation-on-CT-scans-Using-Deep-Neural-Networks
Ohlomonchick/COVID-CT-segmentation-system,1,0,JavaScript,2021-08-13T13:31:23Z,A neural network able to segment lung damage,https://github.com/Ohlomonchick/COVID-CT-segmentation-system
imsidharthj/3D_image_segmentation,1,0,Python,2024-09-17T17:29:37Z,3d model uisng v net convolutional neural network algorithams in Medical Image segmentation of abdominal organs from CT scans,https://github.com/imsidharthj/3D_image_segmentation
For-Anonymous-Use/CaWs-Segmentation-and-Detection,1,0,Python,2024-05-04T12:49:12Z,Codes and Tools for manuscript “A Two-Stage Convolutional Neural Network for Segmentation and Detection of Carotid Web on CT Angiography” submitted to Journal of NeuroInterventional Surgery,https://github.com/For-Anonymous-Use/CaWs-Segmentation-and-Detection
vsanker21/Deep-Learning-Based-Vertebrae-and-Tumor-Segmentation-in-CT-Imaging,1,0,Jupyter Notebook,2025-12-31T05:51:13Z,This study presents a deep learning framework for automated vertebrae and tumor segmentation on CT imaging and directly compares the utility of radiomics versus convolutional neural network (CNN) features for metastasis subtype classification.,https://github.com/vsanker21/Deep-Learning-Based-Vertebrae-and-Tumor-Segmentation-in-CT-Imaging
Ibrahimumutdoruk/Stroke_Detection-and-Segmentation-by-Using-CNN-ML,1,0,Python,2025-04-28T20:46:04Z,"In this project, a convolutional neural network (CNN)  and Machine Learning (ML)based on architecture was developed to classify stroke CT images into three categories: non-stroke, hemorrhage, and ischemic.",https://github.com/Ibrahimumutdoruk/Stroke_Detection-and-Segmentation-by-Using-CNN-ML
SaifSaduddin/Medical-Image-Segmentation-using-Unsupervised-CNN,1,0,Jupyter Notebook,2022-07-14T18:54:02Z,"For my Master's thesis project, I am working with two medical image dataset (Brain image data i.e. CT and DynaCT) to firstly, segment them and then find the similarity between them using an unsupervised Convolution Neural Network (CNN) technique.",https://github.com/SaifSaduddin/Medical-Image-Segmentation-using-Unsupervised-CNN
